{
  "id": "gamesir-g7-se",
  "name": "GameSir G7 SE",
  "vendorId": 13623,
  "productId": 4112,
  "transport": "usb",
  "protocolTypeStr": "gip",
  "reportSize": 36,
  "manufacturer": "GameSir",
  "endpoints": {
    "in": 130,
    "out": 2
  },
  "features": {
    "vibration": true,
    "rgb": true,
    "touchpad": false
  },
  "initSequence": [
    {
      "type": "write",
      "data": [
        5,
        32,
        0,
        1,
        0
      ]
    },
    {
      "type": "delay",
      "delayMs": 10
    },
    {
      "type": "write",
      "data": [
        10,
        32,
        0,
        3,
        0,
        1,
        20
      ]
    },
    {
      "type": "delay",
      "delayMs": 10
    },
    {
      "type": "write",
      "data": [
        6,
        32,
        0,
        2,
        1,
        0
      ]
    }
  ]
}
